{
  "schemaVersion": 2,
  "apiVersion": "44.5.2",
  "probedAt": "2026-11-01",
  "source": "maintainer",
  "probe": {
    "version": "3.0.0",
    "keyCount": 578,
    "keySetSha256": "d08ca44036fed7f5cb5b3cd4fbd144570f4b88ff2267cd206fb29da05b5390a5"
  },
  "rule": "unauthenticated GET; 404 with 'No Route Found' = absent; any other status = present",
  "control": {
    "status": 404,
    "noRouteFound": true
  },
  "results": {
    "GET /accesslog": {
      "status": 404,
      "result": "absent"
    },
    "GET /apikeys": {
      "status": 400,
      "result": "present"
    },
    "GET /apikeys/{}": {
      "status": 404,
      "result": "absent"
    },
    "GET /apns": {
      "status": 404,
      "result": "absent"
    },
    "GET /apns/count": {
      "status": 404,
      "result": "absent"
    },
    "GET /apns/{}": {
      "status": 404,
      "result": "absent"
    },
    "GET /appinfo": {
      "status": 404,
      "result": "absent"
    },
    "GET /apt/installed": {
      "status": 404,
      "result": "absent"
    },
    "GET /apt/installed/{}": {
      "status": 404,
      "result": "absent"
    },
    "GET /apt/repos/{}": {
      "status": 404,
      "result": "absent"
    },
    "GET /apt/servers": {
      "status": 404,
      "result": "absent"
    },
    "GET /auditlog": {
      "status": 404,
      "result": "absent"
    },
    "GET /avatar": {
      "status": 404,
      "result": "absent"
    },
    "GET /avatar/{}": {
      "status": 404,
      "result": "absent"
    },
    "GET /avatar/{}/{}": {
      "status": 404,
      "result": "absent"
    },
    "GET /brand-defaults": {
      "status": 404,
      "result": "absent"
    },
    "GET /brand-defaults/brands": {
      "status": 404,
      "result": "absent"
    },
    "GET /brand-defaults/{}": {
      "status": 404,
      "result": "absent"
    },
    "GET /brand-defaults/{}/{}": {
      "status": 404,
      "result": "absent"
    },
    "GET /brand-defaults/{}/{}/{}": {
      "status": 404,
      "result": "absent"
    },
    "GET /brands": {
      "status": 404,
      "result": "absent"
    },
    "GET /callqueues/count": {
      "status": 404,
      "result": "absent"
    },
    "GET /calls/active-history": {
      "status": 404,
      "result": "absent"
    },
    "GET /cdrs": {
      "status": 400,
      "result": "present"
    },
    "GET /cdrs/count": {
      "status": 400,
      "result": "present"
    },
    "GET /cdrs/stats": {
      "status": 400,
      "result": "present"
    },
    "GET /cdrs/top": {
      "status": 400,
      "result": "present"
    },
    "GET /cdrs/{}": {
      "status": 400,
      "result": "present"
    },
    "GET /cdrs/{}/quality": {
      "status": 404,
      "result": "absent"
    },
    "GET /certificates": {
      "status": 400,
      "result": "present"
    },
    "GET /certificates/count": {
      "status": 400,
      "result": "present"
    },
    "GET /certificates/validate": {
      "status": 400,
      "result": "present"
    },
    "GET /certificates/{}": {
      "status": 400,
      "result": "present"
    },
    "GET /config-definitions": {
      "status": 200,
      "result": "present"
    },
    "GET /config-definitions/{}": {
      "status": 200,
      "result": "present"
    },
    "GET /configurations": {
      "status": 200,
      "result": "present"
    },
    "GET /configurations/count": {
      "status": 200,
      "result": "present"
    },
    "GET /configurations/{}": {
      "status": 200,
      "result": "present"
    },
    "GET /connections": {
      "status": 400,
      "result": "present"
    },
    "GET /connections/count": {
      "status": 400,
      "result": "present"
    },
    "GET /connections/{}": {
      "status": 404,
      "result": "absent"
    },
    "GET /defaults": {
      "status": 404,
      "result": "absent"
    },
    "GET /defaults/objects": {
      "status": 404,
      "result": "absent"
    },
    "GET /defaults/objects/{}/fields": {
      "status": 404,
      "result": "absent"
    },
    "GET /deviceprofiles": {
      "status": 404,
      "result": "absent"
    },
    "GET /deviceprofiles/count": {
      "status": 404,
      "result": "absent"
    },
    "GET /deviceprofiles/image/{}/{}": {
      "status": 404,
      "result": "absent"
    },
    "GET /deviceprofiles/{}/{}": {
      "status": 404,
      "result": "absent"
    },
    "GET /devices": {
      "status": 404,
      "result": "absent"
    },
    "GET /dialplans": {
      "status": 404,
      "result": "absent"
    },
    "GET /dialplans/count": {
      "status": 404,
      "result": "absent"
    },
    "GET /dialplans/list": {
      "status": 404,
      "result": "absent"
    },
    "GET /dialplans/{}": {
      "status": 404,
      "result": "absent"
    },
    "GET /dialplans/{}/dialrules": {
      "status": 404,
      "result": "absent"
    },
    "GET /dialplans/{}/dialrules/count": {
      "status": 404,
      "result": "absent"
    },
    "GET /dialplans/{}/dialrules/list": {
      "status": 404,
      "result": "absent"
    },
    "GET /dialplans/{}/dialrules/{}": {
      "status": 404,
      "result": "absent"
    },
    "GET /dialpolicy": {
      "status": 404,
      "result": "absent"
    },
    "GET /dialpolicy/count": {
      "status": 404,
      "result": "absent"
    },
    "GET /dialpolicy/{}": {
      "status": 404,
      "result": "absent"
    },
    "GET /dialpolicy/{}/permission": {
      "status": 404,
      "result": "absent"
    },
    "GET /dialpolicy/{}/permission/{}": {
      "status": 404,
      "result": "absent"
    },
    "GET /domains": {
      "status": 400,
      "result": "present"
    },
    "GET /domains/count": {
      "status": 400,
      "result": "present"
    },
    "GET /domains/templates": {
      "status": 400,
      "result": "present"
    },
    "GET /domains/templates/count": {
      "status": 400,
      "result": "present"
    },
    "GET /domains/{}": {
      "status": 400,
      "result": "present"
    },
    "GET /domains/{}/addresses": {
      "status": 400,
      "result": "present"
    },
    "GET /domains/{}/addresses/count": {
      "status": 400,
      "result": "present"
    },
    "GET /domains/{}/addresses/endpoints": {
      "status": 400,
      "result": "present"
    },
    "GET /domains/{}/addresses/endpoints/{}": {
      "status": 400,
      "result": "present"
    },
    "GET /domains/{}/addresses/list": {
      "status": 400,
      "result": "present"
    },
    "GET /domains/{}/addresses/{}": {
      "status": 400,
      "result": "present"
    },
    "GET /domains/{}/agents": {
      "status": 400,
      "result": "present"
    },
    "GET /domains/{}/agents/count": {
      "status": 400,
      "result": "present"
    },
    "GET /domains/{}/agents/list": {
      "status": 400,
      "result": "present"
    },
    "GET /domains/{}/agents/{}/status": {
      "status": 404,
      "result": "absent"
    },
    "GET /domains/{}/autoattendants": {
      "status": 400,
      "result": "present"
    },
    "GET /domains/{}/autoattendants/count": {
      "status": 400,
      "result": "present"
    },
    "GET /domains/{}/autoattendants/list": {
      "status": 400,
      "result": "present"
    },
    "GET /domains/{}/billing": {
      "status": 400,
      "result": "present"
    },
    "GET /domains/{}/brands": {
      "status": 404,
      "result": "absent"
    },
    "GET /domains/{}/brands/list": {
      "status": 404,
      "result": "absent"
    },
    "GET /domains/{}/brands/{}": {
      "status": 404,
      "result": "absent"
    },
    "GET /domains/{}/brands/{}/active": {
      "status": 404,
      "result": "absent"
    },
    "GET /domains/{}/brands/{}/list": {
      "status": 404,
      "result": "absent"
    },
    "GET /domains/{}/brands/{}/{}": {
      "status": 404,
      "result": "absent"
    },
    "GET /domains/{}/brands/{}/{}/assets": {
      "status": 404,
      "result": "absent"
    },
    "GET /domains/{}/brands/{}/{}/assets/{}": {
      "status": 404,
      "result": "absent"
    },
    "GET /domains/{}/brands/{}/{}/assets/{}/download": {
      "status": 404,
      "result": "absent"
    },
    "GET /domains/{}/callcenter-codes": {
      "status": 404,
      "result": "absent"
    },
    "GET /domains/{}/callcenter-codes/count": {
      "status": 404,
      "result": "absent"
    },
    "GET /domains/{}/callcenter-codes/list": {
      "status": 404,
      "result": "absent"
    },
    "GET /domains/{}/callcenter-codes/{}": {
      "status": 404,
      "result": "absent"
    },
    "GET /domains/{}/callcenter-reports": {
      "status": 404,
      "result": "absent"
    },
    "GET /domains/{}/callcenter-reports/count": {
      "status": 404,
      "result": "absent"
    },
    "GET /domains/{}/callcenter-reports/{}": {
      "status": 404,
      "result": "absent"
    },
    "GET /domains/{}/callqueuereport/abandoned": {
      "status": 404,
      "result": "absent"
    },
    "GET /domains/{}/callqueuereport/abandoned/{}": {
      "status": 404,
      "result": "absent"
    },
    "GET /domains/{}/callqueues": {
      "status": 400,
      "result": "present"
    },
    "GET /domains/{}/callqueues/count": {
      "status": 400,
      "result": "present"
    },
    "GET /domains/{}/callqueues/list": {
      "status": 400,
      "result": "present"
    },
    "GET /domains/{}/callqueues/{}": {
      "status": 400,
      "result": "present"
    },
    "GET /domains/{}/callqueues/{}/agents": {
      "status": 400,
      "result": "present"
    },
    "GET /domains/{}/callqueues/{}/agents/count": {
      "status": 400,
      "result": "present"
    },
    "GET /domains/{}/callqueues/{}/agents/list": {
      "status": 400,
      "result": "present"
    },
    "GET /domains/{}/callqueues/{}/agents/{}": {
      "status": 404,
      "result": "absent"
    },
    "GET /domains/{}/calls": {
      "status": 400,
      "result": "present"
    },
    "GET /domains/{}/calls/active-history": {
      "status": 400,